year,rank,artist,title,chart
1970,1,Band of Gold Freda Payne,10,Top40Weekly Top 100
1970,2,Mama Told Me (Not to Come) Three Dog Night,11,Top40Weekly Top 100
1970,3,Everything Is Beautiful Ray Stevens,12,Top40Weekly Top 100
1970,4,Make It with You Bread,13,Top40Weekly Top 100
1970,5,Hitchin’ a Ride Vanity Fare,14,Top40Weekly Top 100
1970,6,ABC The Jackson 5,15,Top40Weekly Top 100
1970,7,The Love You Save The Jackson 5,16,Top40Weekly Top 100
1970,8,Cracklin’ Rosie Neil Diamond,17,Top40Weekly Top 100
1970,9,Candida Dawn,18,Top40Weekly Top 100
1970,10,Thank You (Falettinme Be Mice Elf Agin) Sly & the Family Stone,19,Top40Weekly Top 100
1970,11,Spill the Wine Eric Burdon & War,20,Top40Weekly Top 100
1970,12,O-o-h Child Five Stairsteps,21,Top40Weekly Top 100
1970,13,Spirit in the Sky Norman Greenbaum,22,Top40Weekly Top 100
1970,14,Lay Down (Candles in the Rain) Melanie,23,Top40Weekly Top 100
1970,15,Ball of Confusion (That’s What the World Is Today) The Temptations,24,Top40Weekly Top 100
1970,16,Love on a Two-Way Street The Moments,25,Top40Weekly Top 100
1970,17,Which Way You Goin’ Billy? The Poppy Family,26,Top40Weekly Top 100
1970,18,All Right Now Free,27,Top40Weekly Top 100
1970,19,I Want You Back The Jackson 5,28,Top40Weekly Top 100
1970,20,"Julie, Do Ya Love Me Bobby Sherman",29,Top40Weekly Top 100
1970,21,Green-Eyed Lady Sugarloaf,30,Top40Weekly Top 100
1970,22,"Signed, Sealed, Delivered I’m Yours Stevie Wonder",31,Top40Weekly Top 100
1970,23,Ride Captain Ride Blues Image,32,Top40Weekly Top 100
1970,24,Venus Shocking Blue,33,Top40Weekly Top 100
1970,25,Instant Karma! John Lennon,34,Top40Weekly Top 100
1970,26,Patches Clarence Carter,35,Top40Weekly Top 100
1970,27,Lookin’ out My Back Door Creedence Clearwater Revival,36,Top40Weekly Top 100
1970,28,Rainy Night in Georgia Brook Benton,37,Top40Weekly Top 100
1970,29,Something’s Burning Kenny Rogers & The First Edition,38,Top40Weekly Top 100
1970,30,Give Me Just a Little More Time Chairmen of the Board,39,Top40Weekly Top 100
1970,31,Love Grows (Where My Rosemary Goes) Edison Lighthouse,40,Top40Weekly Top 100
1970,32,The Long and Winding Road The Beatles,41,Top40Weekly Top 100
1970,33,Snowbird Anne Murray,42,Top40Weekly Top 100
1970,34,Reflections of My Life Marmalade,43,Top40Weekly Top 100
1970,35,Hey There Lonely Girl Eddie Holman,44,Top40Weekly Top 100
1970,36,The Rapper The Jaggerz,45,Top40Weekly Top 100
1970,37,"He Ain’t Heavy, He’s My Brother The Hollies",46,Top40Weekly Top 100
1970,38,"Tighter, Tighter Alive N Kickin’",47,Top40Weekly Top 100
1970,39,Come and Get It Badfinger,48,Top40Weekly Top 100
1970,40,Cecilia Simon & Garfunkel,49,Top40Weekly Top 100
1970,41,Love Land Charles Wright & the Watts 103rd Street Rhythm Band,50,Top40Weekly Top 100
1970,42,Turn Back the Hands of Time Tyrone Davis,51,Top40Weekly Top 100
1970,43,Lola The Kinks,52,Top40Weekly Top 100
1970,44,In the Summertime Mungo Jerry,53,Top40Weekly Top 100
1970,45,Indiana Wants Me R. Dean Taylor,54,Top40Weekly Top 100
1970,46,Indiana Wants Me R. Dean Taylor,55,Top40Weekly Top 100
1970,47,"Easy Come, Easy Go Bobby Sherman",56,Top40Weekly Top 100
1970,48,Express Yourself Charles Wright & the Watts 103rd Street Rhythm Band,57,Top40Weekly Top 100
1970,49,Still Water (Love) The Four Tops,58,Top40Weekly Top 100
1970,50,Make Me Smile Chicago,59,Top40Weekly Top 100
1970,51,The House of the Rising Sun Frijid Pink,60,Top40Weekly Top 100
1970,52,25 or 6 to 4 Chicago,61,Top40Weekly Top 100
1970,53,My Baby Loves Lovin’ White Plains,62,Top40Weekly Top 100
1970,54,Love or Let Me Be Lonely The Friends of Distinction,63,Top40Weekly Top 100
1970,55,United We Stand The Brotherhood of Man,64,Top40Weekly Top 100
1970,56,We’ve Only Just Begun The Carpenters,65,Top40Weekly Top 100
1970,57,Arizona Mark Lindsay,66,Top40Weekly Top 100
1970,58,Fire and Rain James Taylor,67,Top40Weekly Top 100
1970,59,Groovy Situation Gene Chandler,68,Top40Weekly Top 100
1970,60,Evil Ways Santana,69,Top40Weekly Top 100
1970,61,No Time The Guess Who,70,Top40Weekly Top 100
1970,62,Didn’t I (Blow Your Mind This Time) The Delfonics,71,Top40Weekly Top 100
1970,63,The Wonder of You Elvis Presley,72,Top40Weekly Top 100
1970,64,Up Around the Bend Creedence Clearwater Revival,73,Top40Weekly Top 100
1970,65,(If You Let Me Make Love To You Then) Why Can’t I Touch You? Ronnie Dyson,74,Top40Weekly Top 100
1970,66,I Just Can’t Help Believing B.J. Thomas,75,Top40Weekly Top 100
1970,67,It’s a Shame The Spinners,76,Top40Weekly Top 100
1970,68,For the Love of Him Bobbi Martin,77,Top40Weekly Top 100
1970,69,Mississippi Queen Mountain,78,Top40Weekly Top 100
1970,70,I Want to Take You Higher Ike & Tina Turner,79,Top40Weekly Top 100
1970,71,The Letter Joe Cocker,80,Top40Weekly Top 100
1970,72,Ma Belle Amie Tee Set,81,Top40Weekly Top 100
1970,73,The Bells The Originals,82,Top40Weekly Top 100
1970,74,Yellow River Christie,83,Top40Weekly Top 100
1970,75,Somebody’s Been Sleeping 100 Proof (Aged in Soul),84,Top40Weekly Top 100
1970,76,Vehicle The Ides of March,85,Top40Weekly Top 100
1970,77,Gimme Dat Ding The Pipkins,86,Top40Weekly Top 100
1970,78,Lay a Little Lovin’ On Me Robin McNamara,87,Top40Weekly Top 100
1970,79,Up the Ladder to the Roof The Supremes,88,Top40Weekly Top 100
1970,80,Travelin’ Band Creedence Clearwater Revival,89,Top40Weekly Top 100
1970,81,Come Saturday Morning The Sandpipers,90,Top40Weekly Top 100
1970,82,Psychedelic Shack The Temptations,91,Top40Weekly Top 100
1970,83,Without Love (There Is Nothing) Tom Jones,92,Top40Weekly Top 100
1970,84,Are You Ready? Pacific Gas & Electric,93,Top40Weekly Top 100
1970,85,"Woodstock Crosby, Stills , Nash & Young",94,Top40Weekly Top 100
1970,86,I’ll Never Fall in Love Again Dionne Warwick,95,Top40Weekly Top 100
1970,87,Look What They’ve Done to My Song Ma The New Seekers,96,Top40Weekly Top 100
1970,88,Walk A Mile In My Shoes Joe South,97,Top40Weekly Top 100
1970,89,The Thrill Is Gone B.B. King,98,Top40Weekly Top 100
1970,90,It’s Only Make Believe Glen Campbell,99,Top40Weekly Top 100
1970,91,Call Me Aretha Franklin,100,Top40Weekly Top 100
1970,92,The 1960s,Podcast,Top40Weekly Top 100
1970,93,The 1970s,Podcast,Top40Weekly Top 100
1970,94,The 1960s,Podcast,Top40Weekly Top 100
1970,95,The 1970s,Podcast,Top40Weekly Top 100
1970,96,"enabledLocations: ['Content', 'Recipe'],",window.adthriveCLS = {,Top40Weekly Top 100
1970,97,"injectedFromPlugin: true,","injectedSlots: [],",Top40Weekly Top 100
1970,98,w.adthrive = w.adthrive || {};,"(function(w, d) {",Top40Weekly Top 100
1970,99,w.adthrive.plugin = 'adthrive-ads-3.7.1';,w.adthrive.cmd = w.adthrive.cmd || [];,Top40Weekly Top 100
1970,100,w.adthrive.integration = 'plugin';,w.adthrive.host = 'ads.adthrive.com';,Top40Weekly Top 100
1971,1,Knock Three Times Tony Orlando and Dawn,10,Top40Weekly Top 100
1971,2,Me and Bobby McGee Janis Joplin,11,Top40Weekly Top 100
1971,3,Tired of Being Alone Al Green,12,Top40Weekly Top 100
1971,4,Want Ads Honey Cone,13,Top40Weekly Top 100
1971,5,Smiling Faces Sometimes The Undisputed Truth,14,Top40Weekly Top 100
1971,6,Treat Her Like a Lady Cornelius Brothers & Sister Rose,15,Top40Weekly Top 100
1971,7,You’ve Got a Friend James Taylor,16,Top40Weekly Top 100
1971,8,Mr. Big Stuff Jean Knight,17,Top40Weekly Top 100
1971,9,Brown Sugar The Rolling Stones,18,Top40Weekly Top 100
1971,10,Do You Know What I Mean Lee Michaels,19,Top40Weekly Top 100
1971,11,The Night They Drove Old Dixie Down Joan Baez,20,Top40Weekly Top 100
1971,12,What’s Going On Marvin Gaye,21,Top40Weekly Top 100
1971,13,Uncle Albert/Admiral Halsey Paul & Linda McCartney,22,Top40Weekly Top 100
1971,14,Ain’t No Sunshine Bill Withers,23,Top40Weekly Top 100
1971,15,Signs Five Man Electrical Band,24,Top40Weekly Top 100
1971,16,She’s a Lady Tom Jones,25,Top40Weekly Top 100
1971,17,Superstar Murray Head & The Trinidad Singers,26,Top40Weekly Top 100
1971,18,I’ve Found Someone of My Own The Free Movement,27,Top40Weekly Top 100
1971,19,Amos Moses Jerry Reed,28,Top40Weekly Top 100
1971,20,Temptation Eyes The Grass Roots,29,Top40Weekly Top 100
1971,21,Superstar The Carpenters,30,Top40Weekly Top 100
1971,22,My Sweet Lord George Harrison,31,Top40Weekly Top 100
1971,23,Sweet and Innocent Donny Osmond,32,Top40Weekly Top 100
1971,24,Put Your Hand in the Hand Ocean,33,Top40Weekly Top 100
1971,25,Chick-A-Boom (Don’t Ya Jes’ Love It) Daddy Dewdrop,34,Top40Weekly Top 100
1971,26,For All We Know The Carpenters,35,Top40Weekly Top 100
1971,27,Help Me Make It Through the Night Sammi Smith,36,Top40Weekly Top 100
1971,28,Rainy Days and Mondays The Carpenters,37,Top40Weekly Top 100
1971,29,If You Could Read My Mind Gordon Lightfoot,38,Top40Weekly Top 100
1971,30,"Gypsys, Tramps & Thieves Cher",39,Top40Weekly Top 100
1971,31,Never Can Say Goodbye The Jackson 5,40,Top40Weekly Top 100
1971,32,Rose Garden Lynn Anderson,41,Top40Weekly Top 100
1971,33,"Don’t Pull Your Love Hamilton, Joe Frank & Reynolds",42,Top40Weekly Top 100
1971,34,It Don’t Come Easy Ringo Starr,43,Top40Weekly Top 100
1971,35,Mr. Bojangles Nitty Gritty Dirt Band,44,Top40Weekly Top 100
1971,36,I Love You for All Seasons The Fuzz,45,Top40Weekly Top 100
1971,37,Whatcha See is Whatcha Get The Dramatics,46,Top40Weekly Top 100
1971,38,That’s the Way I’ve Always Heard It Should Be Carly Simon,47,Top40Weekly Top 100
1971,39,If You Really Love Me Stevie Wonder,48,Top40Weekly Top 100
1971,40,Spanish Harlem Aretha Franklin,49,Top40Weekly Top 100
1971,41,I Don’t Know How to Love Him Helen Reddy,50,Top40Weekly Top 100
1971,42,Yo-Yo The Osmonds,51,Top40Weekly Top 100
1971,43,Bridge over Troubled Water Aretha Franklin,52,Top40Weekly Top 100
1971,44,Doesn’t Somebody Want to Be Wanted The Partridge Family,53,Top40Weekly Top 100
1971,45,Draggin’ the Line Tommy James,54,Top40Weekly Top 100
1971,46,Proud Mary Ike & Tina Turner,55,Top40Weekly Top 100
1971,47,Beginnings / Colour My World Chicago,56,Top40Weekly Top 100
1971,48,Stay Awhile The Bells,57,Top40Weekly Top 100
1971,49,Sweet City Woman The Stampeders,58,Top40Weekly Top 100
1971,50,Me and You and a Dog Named Boo Lobo,59,Top40Weekly Top 100
1971,51,"Another Day / Oh Woman, Oh Why Paul McCartney",60,Top40Weekly Top 100
1971,52,If Bread,61,Top40Weekly Top 100
1971,53,Mercy Mercy Me (The Ecology) Marvin Gaye,62,Top40Weekly Top 100
1971,54,One Toke Over the Line Brewer & Shipley,63,Top40Weekly Top 100
1971,55,She’s Not Just Another Woman 8th Day,64,Top40Weekly Top 100
1971,56,Bring the Boys Home Freda Payne,65,Top40Weekly Top 100
1971,57,I Just Want to Celebrate Rare Earth,66,Top40Weekly Top 100
1971,58,Never Ending Song of Love Delaney & Bonnie & Friends,67,Top40Weekly Top 100
1971,59,Easy Loving Freddie Hart,68,Top40Weekly Top 100
1971,60,Liar Three Dog Night,69,Top40Weekly Top 100
1971,61,Stick-Up Honey Cone,70,Top40Weekly Top 100
1971,62,Chirpy Chirpy Cheep Cheep Mac and Katie Kissoon,71,Top40Weekly Top 100
1971,63,(Where Do I Begin?) Love Story Andy Williams,72,Top40Weekly Top 100
1971,64,Wild World Cat Stevens,73,Top40Weekly Top 100
1971,65,"When You’re Hot, You’re Hot Jerry Reed",74,Top40Weekly Top 100
1971,66,Funky Nassau The Beginning of the End,75,Top40Weekly Top 100
1971,67,If Not for You Olivia Newton-John,76,Top40Weekly Top 100
1971,68,Groove Me King Floyd,77,Top40Weekly Top 100
1971,69,Watching Scotty Grow Bobby Goldsboro,78,Top40Weekly Top 100
1971,70,Woodstock Matthews Southern Comfort,79,Top40Weekly Top 100
1971,71,Amazing Grace Judy Collins,80,Top40Weekly Top 100
1971,72,I Hear You Knocking Dave Edmunds,81,Top40Weekly Top 100
1971,73,Lonely Days Bee Gees,82,Top40Weekly Top 100
1971,74,Here Comes That Rainy Day Feeling Again The Fortunes,83,Top40Weekly Top 100
1971,75,Won’t Get Fooled Again The Who,84,Top40Weekly Top 100
1971,76,Trapped By a Thing Called Love Denise LaSalle,85,Top40Weekly Top 100
1971,77,Mama’s Pearl The Jackson 5,86,Top40Weekly Top 100
1971,78,Timothy The Buoys,87,Top40Weekly Top 100
1971,79,I Woke Up In Love This Morning The Partridge Family,88,Top40Weekly Top 100
1971,80,Theme from Shaft Isaac Hayes,89,Top40Weekly Top 100
1971,81,If I Were Your Woman Gladys Knight & the Pips,90,Top40Weekly Top 100
1971,82,I Am…I Said Neil Diamond,91,Top40Weekly Top 100
1971,83,The Wedding Song (There Is Love) Paul Stookey,92,Top40Weekly Top 100
1971,84,Don’t Knock My Love Wilson Pickett,93,Top40Weekly Top 100
1971,85,Love Her Madly The Doors,94,Top40Weekly Top 100
1971,86,Here Comes the Sun Richie Havens,95,Top40Weekly Top 100
1971,87,Sweet Mary Wadsworth Mansion,96,Top40Weekly Top 100
1971,88,Right on the Tip of My Tongue Brenda & the Tabulations,97,Top40Weekly Top 100
1971,89,One Less Bell to Answer The 5th Dimension,98,Top40Weekly Top 100
1971,90,Riders on the Storm The Doors,99,Top40Weekly Top 100
1971,91,Somos Novios (It’s Impossible) Perry Como,100,Top40Weekly Top 100
1971,92,Three Dog Night,Joy to the World,Top40Weekly Top 100
1971,93,Rod Stewart,Maggie May/Reason to Believe,Top40Weekly Top 100
1971,94,Carole King,It’s Too Late/I Feel the Earth Move,Top40Weekly Top 100
1971,95,The Osmonds,One Bad Apple,Top40Weekly Top 100
1971,96,Bee Gees,How Can You Mend a Broken Heart,Top40Weekly Top 100
1971,97,Paul Revere & the Raiders,Indian Reservation (The Lament of the Cherokee Reservation Indian),Top40Weekly Top 100
1971,98,Donny Osmond,Go Away Little Girl,Top40Weekly Top 100
1971,99,John Denver,"Take Me Home, Country Roads",Top40Weekly Top 100
1971,100,The Temptations,Just My Imagination (Running Away with Me),Top40Weekly Top 100
1972,1,Daddy Don’t You Walk So Fast Wayne Newton,10,Top40Weekly Top 100
1972,2,Let’s Stay Together Al Green,11,Top40Weekly Top 100
1972,3,Brandy (You’re a Fine Girl) Looking Glass,12,Top40Weekly Top 100
1972,4,Oh Girl The Chi-Lites,13,Top40Weekly Top 100
1972,5,Nice to Be with You Gallery,14,Top40Weekly Top 100
1972,6,My Ding-a-Ling Chuck Berry,15,Top40Weekly Top 100
1972,7,(If Loving You Is Wrong) I Don’t Want to Be Right Luther Ingram,16,Top40Weekly Top 100
1972,8,Heart of Gold Neil Young,17,Top40Weekly Top 100
1972,9,"Betcha by Golly, Wow The Stylistics",18,Top40Weekly Top 100
1972,10,I’ll Take You There The Staple Singers,19,Top40Weekly Top 100
1972,11,Ben Michael Jackson,20,Top40Weekly Top 100
1972,12,The Lion Sleeps Tonight Robert John,21,Top40Weekly Top 100
1972,13,Outa-Space Billy Preston,22,Top40Weekly Top 100
1972,14,Slippin’ Into Darkness War,23,Top40Weekly Top 100
1972,15,Long Cool Woman in a Black Dress The Hollies,24,Top40Weekly Top 100
1972,16,How Do You Do Mouth & MacNeal,25,Top40Weekly Top 100
1972,17,Song Sung Blue Neil Diamond,26,Top40Weekly Top 100
1972,18,A Horse with No Name America,27,Top40Weekly Top 100
1972,19,Popcorn Hot Butter,28,Top40Weekly Top 100
1972,20,Everybody Plays the Fool The Main Ingredient,29,Top40Weekly Top 100
1972,21,Precious and Few Climax,30,Top40Weekly Top 100
1972,22,(Last Night) I Didn’t Get to Sleep at All The 5th Dimension,31,Top40Weekly Top 100
1972,23,Nights in White Satin The Moody Blues,32,Top40Weekly Top 100
1972,24,Go All the Way Raspberries,33,Top40Weekly Top 100
1972,25,Too Late to Turn Back Now Cornelius Brothers & Sister Rose,34,Top40Weekly Top 100
1972,26,Back Stabbers The O’Jays,35,Top40Weekly Top 100
1972,27,Down by the Lazy River The Osmonds,36,Top40Weekly Top 100
1972,28,Sunshine Jonathan Edwards,37,Top40Weekly Top 100
1972,29,Starting All Over Again Mel and Tim,38,Top40Weekly Top 100
1972,30,Day After Day Badfinger,39,Top40Weekly Top 100
1972,31,Rocket Man Elton John,40,Top40Weekly Top 100
1972,32,Rockin’ Robin Michael Jackson,41,Top40Weekly Top 100
1972,33,Beautiful Sunday Daniel Boone,42,Top40Weekly Top 100
1972,34,Scorpio Dennis Coffey,43,Top40Weekly Top 100
1972,35,Morning Has Broken Cat Stevens,44,Top40Weekly Top 100
1972,36,City of New Orleans Arlo Guthrie,45,Top40Weekly Top 100
1972,37,Garden Party Ricky Nelson,46,Top40Weekly Top 100
1972,38,I Can See Clearly Now Johnny Nash,47,Top40Weekly Top 100
1972,39,Burning Love Elvis Presley,48,Top40Weekly Top 100
1972,40,Clean Up Woman Betty Wright,49,Top40Weekly Top 100
1972,41,Hold Your Head Up Argent,50,Top40Weekly Top 100
1972,42,Jungle Fever The Chakachas,51,Top40Weekly Top 100
1972,43,Everything I Own Bread,52,Top40Weekly Top 100
1972,44,In the Rain The Dramatics,53,Top40Weekly Top 100
1972,45,Look What You Done for Me Al Green,54,Top40Weekly Top 100
1972,46,The Happiest Girl in the Whole U.S.A. Donna Fargo,55,Top40Weekly Top 100
1972,47,Get It On T. Rex,56,Top40Weekly Top 100
1972,48,Mother and Child Reunion Paul Simon,57,Top40Weekly Top 100
1972,49,Where Is the Love Roberta Flack & Donny Hathaway,58,Top40Weekly Top 100
1972,50,I’m Still in Love with You Al Green,59,Top40Weekly Top 100
1972,51,Layla Derek and the Dominos,60,Top40Weekly Top 100
1972,52,Day Dreaming Aretha Franklin,61,Top40Weekly Top 100
1972,53,The Way of Love Cher,62,Top40Weekly Top 100
1972,54,Black and White Three Dog Night,63,Top40Weekly Top 100
1972,55,Sylvia’s Mother Dr. Hook & The Medicine Show,64,Top40Weekly Top 100
1972,56,Hurting Each Other The Carpenters,65,Top40Weekly Top 100
1972,57,Coconut Harry Nilsson,66,Top40Weekly Top 100
1972,58,Puppy Love Donny Osmond,67,Top40Weekly Top 100
1972,59,You Don’t Mess Around with Jim Jim Croce,68,Top40Weekly Top 100
1972,60,Hot Rod Lincoln Commander Cody and His Lost Planet Airmen,69,Top40Weekly Top 100
1972,61,A Cowboy’s Work Is Never Done Sonny & Cher,70,Top40Weekly Top 100
1972,62,Joy Apollo 100,71,Top40Weekly Top 100
1972,63,Anticipation Carly Simon,72,Top40Weekly Top 100
1972,64,Never Been to Spain Three Dog Night,73,Top40Weekly Top 100
1972,65,Kiss an Angel Good Mornin’ Charley Pride,74,Top40Weekly Top 100
1972,66,School’s Out Alice Cooper,75,Top40Weekly Top 100
1972,67,Saturday in the Park Chicago,76,Top40Weekly Top 100
1972,68,Drowning in the Sea of Love Joe Simon,77,Top40Weekly Top 100
1972,69,Use Me Bill Withers,78,Top40Weekly Top 100
1972,70,Family Affair Sly & the Family Stone,79,Top40Weekly Top 100
1972,71,Troglodyte (Cave Man) The Jimmy Castor Bunch,80,Top40Weekly Top 100
1972,72,The Witch queen of New Orleans Redbone,81,Top40Weekly Top 100
1972,73,Freddie’s Dead Curtis Mayfield,82,Top40Weekly Top 100
1972,74,Power of Love Joe Simon,83,Top40Weekly Top 100
1972,75,Power of Love Joe Simon,84,Top40Weekly Top 100
1972,76,Taxi Harry Chapin,85,Top40Weekly Top 100
1972,77,Don’t Say You Don’t Remember Beverly Bremers,86,Top40Weekly Top 100
1972,78,Sealed with a Kiss Bobby Vinton,87,Top40Weekly Top 100
1972,79,I Saw the Light Todd Rundgren,88,Top40Weekly Top 100
1972,80,Motorcycle Mama Sailcat,89,Top40Weekly Top 100
1972,81,Day by Day Original Cast of Godspell,90,Top40Weekly Top 100
1972,82,Roundabout Yes,91,Top40Weekly Top 100
1972,83,Doctor My Eyes Jackson Browne,92,Top40Weekly Top 100
1972,84,I’d Like to Teach the World to Sing (In Perfect Harmony) The New Seekers,93,Top40Weekly Top 100
1972,85,Vincent Don McLean,94,Top40Weekly Top 100
1972,86,Baby Let Me Take You (In My Arms) The Detroit Emeralds,95,Top40Weekly Top 100
1972,87,Speak to the Sky Rick Springfield,96,Top40Weekly Top 100
1972,88,I’d Like to Teach the World to Sing (In Perfect Harmony) The Hillside Singers,97,Top40Weekly Top 100
1972,89,Walkin’ in the Rain with the One I Love Love Unlimited,98,Top40Weekly Top 100
1972,90,Get on the Good Foot James Brown,99,Top40Weekly Top 100
1972,91,Pop That Thang The Isley Brothers,100,Top40Weekly Top 100
1972,92,Roberta Flack,The First Time Ever I Saw Your Face,Top40Weekly Top 100
1972,93,Gilbert O’Sullivan,Alone Again (Naturally),Top40Weekly Top 100
1972,94,Don McLean,American Pie,Top40Weekly Top 100
1972,95,Harry Nilsson,Without You,Top40Weekly Top 100
1972,96,"Sammy Davis, Jr.",The Candy Man,Top40Weekly Top 100
1972,97,Joe Tex,I Gotcha,Top40Weekly Top 100
1972,98,Bill Withers,Lean on Me,Top40Weekly Top 100
1972,99,Mac Davis,"Baby, Don’t Get Hooked on Me",Top40Weekly Top 100
1972,100,Melanie,Brand New Key,Top40Weekly Top 100
1973,1,Touch Me in the Morning Diana Ross,10,Top40Weekly Top 100
1973,2,The Night the Lights Went Out in Georgia Vicki Lawrence,11,Top40Weekly Top 100
1973,3,Playground in My Mind Clint Holmes,12,Top40Weekly Top 100
1973,4,Brother Louie Stories,13,Top40Weekly Top 100
1973,5,Delta Dawn Helen Reddy,14,Top40Weekly Top 100
1973,6,Me and Mrs. Jones Billy Paul,15,Top40Weekly Top 100
1973,7,Frankenstein The Edgar Winter Group,16,Top40Weekly Top 100
1973,8,Drift Away Dobie Gray,17,Top40Weekly Top 100
1973,9,Little Willy Sweet,18,Top40Weekly Top 100
1973,10,You Are the Sunshine of My Life Stevie Wonder,19,Top40Weekly Top 100
1973,11,Half-Breed Cher,20,Top40Weekly Top 100
1973,12,That Lady The Isley Brothers,21,Top40Weekly Top 100
1973,13,Pillow Talk Sylvia,22,Top40Weekly Top 100
1973,14,We’re an American Band Grand Funk Railroad,23,Top40Weekly Top 100
1973,15,Right Place Wrong Time Dr. John,24,Top40Weekly Top 100
1973,16,Wildflower Skylark,25,Top40Weekly Top 100
1973,17,Superstition Stevie Wonder,26,Top40Weekly Top 100
1973,18,Loves Me Like a Rock Paul Simon,27,Top40Weekly Top 100
1973,19,The Morning After Maureen McGovern,28,Top40Weekly Top 100
1973,20,Rocky Mountain High John Denver,29,Top40Weekly Top 100
1973,21,Stuck in the Middle with You Stealers Wheel,30,Top40Weekly Top 100
1973,22,Shambala Three Dog Nigh,31,Top40Weekly Top 100
1973,23,Love Train The O’Jays,32,Top40Weekly Top 100
1973,24,I’m Gonna Love You Just a Little More Baby Barry White,33,Top40Weekly Top 100
1973,25,"Say, Has Anybody Seen My Sweet Gypsy Rose Tony Orlando and Dawn",34,Top40Weekly Top 100
1973,26,Keep on Truckin’ Eddie Kendricks,35,Top40Weekly Top 100
1973,27,Danny’s Song Anne Murray,36,Top40Weekly Top 100
1973,28,Dancing in the Moonlight King Harvest,37,Top40Weekly Top 100
1973,29,Monster Mash Bobby Boris Pickett and the Crypt-Kickers,38,Top40Weekly Top 100
1973,30,Natural High Bloodstone,39,Top40Weekly Top 100
1973,31,Diamond Girl Seals and Crofts,40,Top40Weekly Top 100
1973,32,Long Train Runnin’ The Doobie Brothers,41,Top40Weekly Top 100
1973,33,Give Me Love (Give Me Peace on Earth) George Harrison,42,Top40Weekly Top 100
1973,34,If You Want Me to Stay Sly & the Family Stone,43,Top40Weekly Top 100
1973,35,Daddy’s Home Jermaine Jackson,44,Top40Weekly Top 100
1973,36,Neither One of Us (Wants to Be the First to Say Goodbye) Gladys Knight & the Pips,45,Top40Weekly Top 100
1973,37,I’m Doin’ Fine Now New York City,46,Top40Weekly Top 100
1973,38,Could It Be I’m Falling in Love The Spinners,47,Top40Weekly Top 100
1973,39,Daniel Elton John,48,Top40Weekly Top 100
1973,40,Midnight Train to Georgia Gladys Knight & the Pips,49,Top40Weekly Top 100
1973,41,Smoke on the Water Deep Purple,50,Top40Weekly Top 100
1973,42,The Cover of the Rolling Stone Dr. Hook & The Medicine Show,51,Top40Weekly Top 100
1973,43,Behind Closed Doors Charlie Rich,52,Top40Weekly Top 100
1973,44,Your Mama Don’t Dance Loggins and Messina,53,Top40Weekly Top 100
1973,45,Feelin’ Stronger Every Day Chicago,54,Top40Weekly Top 100
1973,46,The Cisco Kid War,55,Top40Weekly Top 100
1973,47,Live and Let Die Paul McCartney & Wings,56,Top40Weekly Top 100
1973,48,"Oh, Babe, What Would You Say? Hurricane Smith",57,Top40Weekly Top 100
1973,49,I Believe in You (You Believe in Me) Johnnie Taylor,58,Top40Weekly Top 100
1973,50,Sing The Carpenters,59,Top40Weekly Top 100
1973,51,Ain’t No Woman (Like the One I’ve Got) The Four Tops,60,Top40Weekly Top 100
1973,52,Dueling Banjos Eric Weissberg & Steve Mandell,61,Top40Weekly Top 100
1973,53,Higher Ground Stevie Wonder,62,Top40Weekly Top 100
1973,54,Here I Am (Come and Take Me) Al Green,63,Top40Weekly Top 100
1973,55,My Maria B.W. Stevenson,64,Top40Weekly Top 100
1973,56,Superfly Curtis Mayfield,65,Top40Weekly Top 100
1973,57,ArizonaLast Song Edward Bear,66,Top40Weekly Top 100
1973,58,Get Down Gilbert O’Sullivan,67,Top40Weekly Top 100
1973,59,Reelin’ in the Years Steely Dan,68,Top40Weekly Top 100
1973,60,Hocus Pocus Focus,69,Top40Weekly Top 100
1973,61,Yesterday Once More The Carpenters,70,Top40Weekly Top 100
1973,62,Boogie Woogie Bugle Boy Bette Midler,71,Top40Weekly Top 100
1973,63,Clair Gilbert O’Sullivan,72,Top40Weekly Top 100
1973,64,Do It Again Steely Dan,73,Top40Weekly Top 100
1973,65,Kodachrome Paul Simon,74,Top40Weekly Top 100
1973,66,Why Can’t We Live Together Timmy Thomas,75,Top40Weekly Top 100
1973,67,Do You Wanna Dance? Bette Midler,76,Top40Weekly Top 100
1973,68,So Very Hard to Go Tower of Power,77,Top40Weekly Top 100
1973,69,Rockin’ Pneumonia and the Boogie Woogie Flu Johnny Rivers,78,Top40Weekly Top 100
1973,70,Ramblin’ Man The Allman Brothers Band,79,Top40Weekly Top 100
1973,71,Masterpiece The Temptations,80,Top40Weekly Top 100
1973,72,Peaceful Helen Reddy,81,Top40Weekly Top 100
1973,73,One of a Kind (Love Affair) The Spinners,82,Top40Weekly Top 100
1973,74,Funny Face Donna Fargo,83,Top40Weekly Top 100
1973,75,Funky Worm Ohio Players,84,Top40Weekly Top 100
1973,76,Angie The Rolling Stones,85,Top40Weekly Top 100
1973,77,Jambalaya (On the Bayou) Blue Ridge Rangers,86,Top40Weekly Top 100
1973,78,Don’t Expect Me to Be Your Friend Lobo,87,Top40Weekly Top 100
1973,79,Break Up to Make Up The Stylistics,88,Top40Weekly Top 100
1973,80,Daisy a Day Jud Strunk,89,Top40Weekly Top 100
1973,81,Also Sprach Zarathustra (2001) Deodato,90,Top40Weekly Top 100
1973,82,Stir It Up Johnny Nash,91,Top40Weekly Top 100
1973,83,Money Pink Floyd,92,Top40Weekly Top 100
1973,84,Gypsy Man War,93,Top40Weekly Top 100
1973,85,The World Is a Ghetto War,94,Top40Weekly Top 100
1973,86,Yes We Can Can The Pointer Sisters,95,Top40Weekly Top 100
1973,87,Free Ride The Edgar Winter Group,96,Top40Weekly Top 100
1973,88,Space Oddity David Bowie,97,Top40Weekly Top 100
1973,89,It Never Rains in Southern California Albert Hammond,98,Top40Weekly Top 100
1973,90,The Twelfth of Never Donny Osmond,99,Top40Weekly Top 100
1973,91,Papa Was a Rollin’ Stone The Temptations,100,Top40Weekly Top 100
